<?xml version="1.0" encoding="UTF-8" standalone="no"?><!-- <!DOCTYPE Personnes PUBLIC "-//W3C//DTD XHTML 1.0 Strict//EN" "./files.dtd"> --><Personnes xmlns:xsi="http://www.w3.org/2001/XMLSchema-instance" xsi:noNamespaceSchemaLocation="personne.xsd">
    <?xml-stylesheet href="./personnes.xml" type="text/xsl"?>
    <Personne sexe="Femme">
        <nom>AMIMI</nom>
        <prenom>ABDENASSAR</prenom>
        <adresse>Taounate</adresse>
        <mail>abdenassaramimi@gmail.com</mail>
        <telephone>696788244</telephone>
    </Personne>

    
    <Personne sexe="Femme">
        <nom>abde</nom>
        <prenom>nassar</prenom>
        <adresse>martil</adresse>
        <mail>nassar@mail.com</mail>
        <telephone>0267152276</telephone>
    </Personne>
    
</Personnes>