<?xml version="1.0" encoding="UTF-8" standalone="no"?><!-- <!DOCTYPE Personnes PUBLIC "-//W3C//DTD XHTML 1.0 Strict//EN" "./files.dtd"> --><Personnes xmlns:xsi="http://www.w3.org/2001/XMLSchema-instance" xsi:noNamespaceSchemaLocation="personne.xsd">
    
    <Personne sexe="Femme">
        <nom>AMIMI</nom>
        <prenom>ABDENASSAR</prenom>
        <adresse>Taounate</adresse>
        <mail>abdenassaramimi@gmail.com</mail>
        <telephone>696788244</telephone>
    </Personne>

    <Personne sexe="Homme">
        <nom>AMIMI</nom>
        <prenom>ABDENASSAR</prenom>
        <adresse>Taounate</adresse>
        <mail>abdenassaramimi@gmail.com</mail>
        <telephone>696788244</telephone>
    </Personne> 
<Personne>
    <nom>nassar</nom>
    <prenom>kGS</prenom>
    <adresse>GDJAFJG</adresse>
    <mail>HKAGDK</mail>
    <telephone>JDKHA</telephone>
</Personne>
    <Personne><nom>nassar</nom><prenom>kGS</prenom><adresse>GDJAFJG</adresse><mail>HKAGDK</mail><telephone>JDKHA</telephone></Personne><Personne><nom>nassar</nom><prenom>kGS</prenom><adresse>GDJAFJG</adresse><mail>HKAGDK</mail><telephone>JDKHA</telephone></Personne><Personne><nom>nassar</nom><prenom>kGS</prenom><adresse>GDJAFJG</adresse><mail>HKAGDK</mail><telephone>JDKHA</telephone></Personne><Personne><nom>nassar</nom><prenom>kGS</prenom><adresse>GDJAFJG</adresse><mail>HKAGDK</mail><telephone>JDKHA</telephone></Personne>
</Personnes>